[
  {
    "date": "2026-09-25",
    "version": "0.2.0",
    "method": "浏览器公开页面检索与选读；不等同于全量爬取",
    "human_review": "not_yet_reviewed",
    "notes": [
      "初始文字与数据由 AI 整理；需要维护者人工复核后合并。",
      "没有把旧包中的条目自动当作事实。",
      "未核听播客、未复现历史代码、未审计付费交付、未冻结网页快照。",
      "检索工具可能返回缓存页面；checked_at 是本次核对日期，不保证源站当时实时刷新。"
    ]
  }
]
